{
  "execution_id": "2917bbe0-6d87-4805-9542-8fbec824f343",
  "strategy": "ClassicDonchianBreakout@v1.0",
  "strategy_name": "ClassicDonchianBreakout",
  "strategy_version": "v1.0",
  "campaign_id": "spc-official-cdb-v1",
  "symbol": "SOL/USDT",
  "timeframe": "1h",
  "side": "BUY",
  "entry_timestamp": "2026-08-01T12:00:00+00:00",
  "signal_snapshot_id": 12345,
  "trade_history_id": 67890,
  "entry_reason": "donchian_breakout_up",
  "market_regime": "tendencia_forte_alta|alta_volatilidade|expansao",
  "trend_regime": "tendencia_forte_alta",
  "volatility_regime": "alta_volatilidade",
  "volume_regime": "alto_volume",
  "indicator_context": {
    "adx": 31.02,
    "atr": 22.33,
    "atr_pct": 0.0051,
    "rsi": 61.8,
    "macd": 0.34,
    "macd_signal": 0.12,
    "macd_hist": 0.22,
    "ema_fast": 5435.02,
    "ema_slow": 5443.43,
    "relative_volume": 1.95,
    "donchian_upper": 561.73,
    "donchian_lower": 546.21,
    "donchian_width": 0.0276,
    "candle_body": 0.0063,
    "candle_range": 0.0086,
    "spread": null,
    "distance_breakout": 0.0023,
    "distance_to_ema_fast": 0.0017,
    "distance_to_ema_slow": 0.0031,
    "close": 563.05,
    "high": 569.38,
    "low": 559.14,
    "open": 559.94,
    "volume": 9819.1,
    "volume_average": 6103.8
  },
  "entry_snapshot": {
    "symbol": "SOL/USDT",
    "timeframe": "1h",
    "campaign_id": "spc-official-cdb-v1",
    "strategy_name": "ClassicDonchianBreakout",
    "strategy_version": "v1.0",
    "strategy_key": "ClassicDonchianBreakout@v1.0",
    "entry_reason": "donchian_breakout_up",
    "timestamp": "2026-08-01T12:00:00+00:00",
    "accepted": true,
    "rejection_reason": null,
    "score": 1.0,
    "entry_price": 563.05,
    "stop_loss": 551.79,
    "take_profit": 585.57,
    "risk_reward": 2.0,
    "market_regime": "tendencia_forte_alta|alta_volatilidade|expansao",
    "trend_regime": "tendencia_forte_alta",
    "volatility_regime": "alta_volatilidade",
    "volume_regime": "alto_volume"
  },
  "exit_snapshot": {
    "exit_reason": "take_profit",
    "exit_timestamp": "2026-08-01T16:00:00+00:00",
    "holding_time_minutes": 240.0,
    "mfe": 0.0290,
    "mae": -0.0044,
    "return_pct": 0.0129,
    "pnl": 2.1463,
    "realized_rr": 1.91,
    "take_profit": 585.57,
    "stop_loss": 551.79,
    "exit_price": 570.31
  },
  "snapshot_complete": true,
  "missing_fields": []
}